"Ottawa stands by U.S. as safe third country, despite new border policy",https://www.cbc.ca/news/canada,2019-07-18 15:36:52
Toronto mayor wants independent review after man deemed a threat flees Canada,https://www.cbc.ca/news/canada,2019-07-18 15:36:52
Ottawa to pay nearly $1B to settle sexual misconduct lawsuits against Canadian Armed Forces,https://www.cbc.ca/news/canada,2019-07-18 15:36:52
"12,000 L of oil spilled into ocean off Newfoundland, causing oil rig shutdown",https://www.cbc.ca/news/canada,2019-07-18 15:36:52
"'Exemplary' medical student who raped unconscious woman caved to temptation, lawyer argues",https://www.cbc.ca/news/canada,2019-07-18 15:36:52
"China can afford to wait out Canada in diplomatic dispute, Japanese ambassador warns",https://www.cbc.ca/news/canada,2019-07-18 15:36:52
Quebec Superior Court upholds religious symbols ban,https://www.cbc.ca/news/canada,2019-07-18 15:36:52
Canada's highest court won't hear WestJet appeal in sexual harassment case,https://www.cbc.ca/news/canada,2019-07-18 15:36:52
Inuit describe 'bittersweet' experience at burial sites of lost loved ones in South ,https://www.cbc.ca/news/canada,2019-07-18 15:36:52
EU president takes shot at Trump's 'unacceptable' tweets after Trudeau meeting,https://www.cbc.ca/news/canada,2019-07-18 15:36:52
New documentary Once Were Brothers: Robbie Robertson and The Band to open TIFF 2019,https://www.cbc.ca/news/canada,2019-07-18 15:36:52
"What Arctic ice can tell us about plagues, climate and conflict in the Middle Ages",https://www.cbc.ca/news/canada,2019-07-18 15:36:52
TD customers question how Visa Debit chequing accounts were compromised,https://www.cbc.ca/news/canada,2019-07-18 15:36:52
Canada gets its first-ever intelligence commissioner,https://www.cbc.ca/news/canada,2019-07-18 15:36:52
"Fat cats: Felines heavier now than in 1990s, study finds",https://www.cbc.ca/news/canada,2019-07-18 15:36:52
Too ugly to survive: Signal Hill fence demolition complete,https://www.cbc.ca/news/canada,2019-07-18 15:36:52
Edmonton teacher charged with sexual assault involving student,https://www.cbc.ca/news/canada,2019-07-18 15:36:52
Drugs make her a 'monster:' A Hamilton family's cry for help fighting addiction,https://www.cbc.ca/news/canada,2019-07-18 15:36:52
'I loved her': Greg Fertuck denies killing his wife Sheree in interview at Saskatoon jail,https://www.cbc.ca/news/canada,2019-07-18 15:36:52
Police seize $35M in assets from alleged Ontario crime family with ties to Italian Mafia,https://www.cbc.ca/news/canada,2019-07-18 15:36:52
"High court won't hear NDP expenses case over mailings, offices",https://www.cbc.ca/news/canada,2019-07-18 15:36:52
Fort St. James declares financial crisis following sawmill closure,https://www.cbc.ca/news/canada,2019-07-18 15:36:52
Edmonton teacher charged with sexual assault involving student,https://www.cbc.ca/news/canada,2019-07-18 15:36:52
Boy who watched friend drown warns against the dangers of St. Lawrence River,https://www.cbc.ca/news/canada,2019-07-18 15:36:52
'It hasn't fazed her': Toddler faces throat reconstruction after swallowing teddy bear eye last year,https://www.cbc.ca/news/canada,2019-07-18 15:36:52
Florida man's quest to see if Richard Hatfield was his father,https://www.cbc.ca/news/canada,2019-07-18 15:36:52
2 Alberta flocks quarantined after fatal disease related to mad cow found in a sheep,https://www.cbc.ca/news/canada,2019-07-18 15:36:52
Kindergym: Inside the world of competitive child weightlifting,https://www.cbc.ca/news/canada,2019-07-18 15:36:52
"Rent in Ottawa out of reach for low-income earners, report finds",https://www.cbc.ca/news/canada,2019-07-18 15:36:52
"No stranger to pain, Mike Woods pedals on with broken ribs at Tour de France",https://www.cbc.ca/news/canada,2019-07-18 15:36:52
Ottawa to pay nearly $1B to settle sexual misconduct lawsuits against Canadian Armed Forces,https://www.cbc.ca/news/canada,2019-07-18 15:36:52
Quebec's religious symbols law passes 1st legal test as judge refuses injunction,https://www.cbc.ca/news/canada,2019-07-18 15:36:52
Community policing to be restored in 3 neighbourhoods,https://www.cbc.ca/news/canada,2019-07-18 15:36:52
"When you can't escape the heat, you're in a 'heat dome'",https://www.cbc.ca/news/canada,2019-07-19 09:12:45
Dennis Oland not guilty of murder in retrial over 2011 death of multimillionaire father ,https://www.cbc.ca/news/canada,2019-07-19 09:12:45
Dismantled Signal Hill fence cost $65K before outcry led to removal: Parks Canada,https://www.cbc.ca/news/canada,2019-07-19 09:12:45
Is the doctor shortage stalling the Me Too movement in the medical field?,https://www.cbc.ca/news/canada,2019-07-19 09:12:45
Are there still NDP voters in a province that just passed a religious symbols law? Singh looks to find out,https://www.cbc.ca/news/canada,2019-07-19 09:12:45
Ottawa sets aside $900M to settle sexual misconduct lawsuits against Canadian Armed Forces,https://www.cbc.ca/news/canada,2019-07-19 09:12:45
Who's really behind Toronto's chain of illegal pot shops that won't quit?,https://www.cbc.ca/news/canada,2019-07-19 09:12:45
Fish farm on Cape Breton reserve pairs up with Cooke Aquaculture,https://www.cbc.ca/news/canada,2019-07-19 09:12:45
Toronto mayor wants independent review after man deemed a threat flees Canada,https://www.cbc.ca/news/canada,2019-07-19 09:12:45
"Refusing to be ignored, Roberta Bondar took up space as Canada's 1st female astronaut",https://www.cbc.ca/news/canada,2019-07-19 09:12:45
"Ottawa stands by U.S. as safe third country, despite new border policy",https://www.cbc.ca/news/canada,2019-07-19 09:12:45
Titans crew member killed during special effects test in Toronto,https://www.cbc.ca/news/canada,2019-07-19 09:12:45
Pallister wants to attract Quebec civil servants worried about 'clothing police',https://www.cbc.ca/news/canada,2019-07-19 09:12:45
"Conservatives 'declaring war on Canada Food Guide' like they did on long-form census, Trudeau says",https://www.cbc.ca/news/canada,2019-07-19 09:12:45
"12,000 L of oil spilled into ocean off Newfoundland, causing oil rig shutdown",https://www.cbc.ca/news/canada,2019-07-19 09:12:45
Quebec Superior Court upholds religious symbols ban,https://www.cbc.ca/news/canada,2019-07-19 09:12:45
Canada's highest court won't hear WestJet appeal in sexual harassment case,https://www.cbc.ca/news/canada,2019-07-19 09:12:45
This Toronto woman says a Gambian dictator raped her. Now she's fighting for justice,https://www.cbc.ca/news/canada,2019-07-19 09:12:45
Inuit describe 'bittersweet' experience at burial sites of lost loved ones in South ,https://www.cbc.ca/news/canada,2019-07-19 09:12:45
"'Exemplary' medical student who raped unconscious woman caved to temptation, lawyer argues",https://www.cbc.ca/news/canada,2019-07-19 09:12:45
EU president takes shot at Trump's 'unacceptable' tweets after Trudeau meeting,https://www.cbc.ca/news/canada,2019-07-19 09:12:45
TD customers question how Visa Debit chequing accounts were compromised,https://www.cbc.ca/news/canada,2019-07-19 09:12:45
"Fat cats: Felines heavier now than in 1990s, study finds",https://www.cbc.ca/news/canada,2019-07-19 09:12:45
"China can afford to wait out Canada in diplomatic dispute, Japanese ambassador warns",https://www.cbc.ca/news/canada,2019-07-19 09:12:45
New documentary Once Were Brothers: Robbie Robertson and The Band to open TIFF 2019,https://www.cbc.ca/news/canada,2019-07-19 09:12:45
"What Arctic ice can tell us about plagues, climate and conflict in the Middle Ages",https://www.cbc.ca/news/canada,2019-07-19 09:12:45
Canada gets its first-ever intelligence commissioner,https://www.cbc.ca/news/canada,2019-07-19 09:12:45
Too ugly to survive: Signal Hill fence demolition complete,https://www.cbc.ca/news/canada,2019-07-19 09:12:45
15-year study tallies toll of sexual assault in Ontario,https://www.cbc.ca/news/canada,2019-07-19 09:12:45
"2 years after Mary Papatsie disappeared, family seeks closure",https://www.cbc.ca/news/canada,2019-07-19 09:12:45
PSAC unimpressed with mass government email on Phoenix offer ,https://www.cbc.ca/news/canada,2019-07-19 09:12:45
Caitlan Coleman says she spoke to media during trial to give women hope,https://www.cbc.ca/news/canada,2019-07-19 09:12:45
"For dogs, jumping in the water can be sink or swim",https://www.cbc.ca/news/canada,2019-07-19 09:12:45
